{
  "source_packet_version": "v1",
  "source_id": "case_002",
  "patient_label": "Patient B",
  "encounter_context": {
    "setting": "Emergency Department",
    "encounter_reason": "74-year-old woman with atrial fibrillation on warfarin presenting after syncope; pacemaker-dependent with recent supratherapeutic INR.",
    "time_window": "this week"
  },
  "active_problems": [
    "Syncope",
    "Pacemaker-dependent rhythm",
    "Supratherapeutic INR on warfarin"
  ],
  "chronic_conditions": [
    "Atrial fibrillation",
    "Pacemaker dependence",
    "Chronic kidney disease"
  ],
  "recent_changes": [
    "INR increased to 4.6 this week.",
    "Recent syncopal episode at home."
  ],
  "medications": [
    {
      "name": "Warfarin",
      "status": "held",
      "timing_or_schedule": "reassess after repeat INR",
      "why_important": "Supratherapeutic INR 4.6 — do not restart until INR is reassessed."
    }
  ],
  "procedures_and_devices": [
    "Permanent pacemaker",
    "Continuous telemetry monitoring"
  ],
  "safety_critical_facts": [
    "Do not restart warfarin until INR is reassessed.",
    "Pacemaker-dependent patient requires monitored disposition."
  ],
  "disposition_and_follow_up": [
    "Cardiology consultation and monitored admission."
  ],
  "supporting_source_excerpts": [
    {
      "label": "Cardiology note",
      "text": "Pacemaker-dependent rhythm."
    },
    {
      "label": "Lab result",
      "text": "INR 4.6; warfarin held."
    }
  ]
}
